{
  "schema_version": 1,
  "network_id": "xworkmate-private",
  "node_id": "fixture-gateway",
  "generation": 1,
  "issued_at": "2026-08-27T12:00:00Z",
  "expires_at": "2026-08-27T12:05:00Z",
  "proxy_core": "xray",
  "peers": [
    {
      "device_id": "fixture-device",
      "public_key": "AAAAAAAAAAAAAAAAAAAAAAAAAAAAAAAAAAAAAAAAAAA=",
      "address": "172.29.10.10/32",
      "allowed_ips": ["172.29.10.10/32"]
    }
  ],
  "policies": [],
  "relay": {"backend": "xray", "transport": "vless", "security": "tls"},
  "signature": {"key_id": "fixture-key", "algorithm": "Ed25519", "value": "fixture"}
}
